{"schema":"asb.protoXref/2","datasetVersion":"2026.09.1","rankingVersion":"asb.rank.v2","book":56,"osis":"Titus","legend":{"verse":["counts","ticker","byMatch"],"counts":["out","in","inDirect","inViaRange","unique"],"ticker":"the top 40 chips in rank order, then every lower-ranked chip matching at 60% or better; each chip's rank is its position in the verse's full list; the strip shows the first 12 that pass the Match slider and reason filter","byMatch":"20 counts over all connections of the verse: bucket i holds match percentages in [5i, 5i+5), 100% in the last bucket","chip":["start","end","direction","votesOut","votesIn","score","weight","tier","viaRange","reason","rank"],"direction":["out","in","both"],"tier":["strong","solid","light"],"viaRange":"0 or [start,end,span]","reason":"[kind, basis, confidence, becauseIndex]; kind and basis index reasonKinds and reasonBases, becauseIndex indexes the top-level because list","reasonKinds":["quote","story","topic"],"reasonBases":["sharedWording","quotation","parallelAccount","retelling","samePassage","sharedNames","theme"]},"because":["Titus 1:1 and Romans 1:1 share the same words","Shared theme: Christ and Jesus","Titus 1:1 and 2 Timothy 2:25 share the same words","Shared theme: faith","Titus 1:1 and 1 Timothy 2:4 share the same words","Both tell of Paul","Shared theme: Paul, Christ and servant","Linked by theme","Shared theme: godliness and knowledge","Shared theme: servant","Shared theme: Christ","Shared theme: truth, faith and Christ","Shared theme: godliness","Shared theme: Christ, servant and Jesus","Shared theme: knowledge, Christ and Jesus","Shared theme: faith and Jesus","Shared theme: leads","Shared theme: elect","Shared theme: apostle","Titus 1:1 and 2 Peter 1:1 share the same words","Shared theme: promised and lie","Shared theme: promised and life","Shared theme: began","Titus 1:2 and Titus 3:7 share the same words","Shared theme: life","Shared theme: hope","Shared theme: promised","Shared theme: cannot","Shared theme: eternal, promised and life","Shared theme: eternal and life","Shared theme: hope and lie","Shared theme: lie","Shared theme: hope, promised and lie","Shared theme: eternal","Titus 1:3 and 1 Timothy 1:1 share the same words","Shared theme: entrusted","Shared theme: Savior","Titus 1:3 and Titus 3:4–6 share the same words","Shared theme: command","Titus 1:3 and 1 Timothy 2:3 share the same words","Another part of the same passage in Titus 1","Shared theme: Savior, faith and Christ","Both tell of Titus","Shared theme: child, grace and peace","Shared theme: child, grace and true","Shared theme: grace, peace and Christ","Shared theme: Titus","Shared theme: Savior and Christ","Shared theme: Savior and true","Shared theme: Savior, child and grace","Shared theme: Savior, Christ and Jesus","Shared theme: Savior, grace and Christ","Shared theme: Savior and Jesus","Shared theme: Christ, Jesus and father","Shared theme: child and father","Shared theme: elders and appoint","Shared theme: Crete","Shared theme: elders","Shared theme: order","Shared theme: appoint","Titus 1:6 and 1 Timothy 3:2–7 share the same words","Titus 1:6 and 1 Timothy 3:12 share the same words","Shared theme: wife","Shared theme: indiscretion","Shared theme: children","Shared theme: husband","Shared theme: blameless and children","Shared theme: accusation and elder","Shared theme: self","Shared theme: steward","Shared theme: violent and money","Shared theme: overseer","Shared theme: overseer, greedy and violent","Shared theme: tempered and quick","Shared theme: tempered","Shared theme: quick","Shared theme: overseer, self and reproach","Shared theme: greedy","Shared theme: hospitable, controlled and self","Shared theme: self and good","Shared theme: good","Shared theme: holy","Shared theme: controlled and self","Shared theme: disciplined","Shared theme: sound, hold and teaching","Shared theme: sound and teaching","Shared theme: sound, teaching and word","Shared theme: sound","Shared theme: firmly and taught","Shared theme: hold","Shared theme: faithful, teaching and others","Shared theme: refute","Shared theme: teaching","Shared theme: word","Shared theme: talk and empty","Shared theme: talk","Shared theme: circumcision","Shared theme: deception","Shared theme: households","Shared theme: gain","Shared theme: teach","Shared theme: silenced","Shared theme: sake","Shared theme: cretans","Shared theme: liars","Shared theme: prophets","Shared theme: sound and faith","Shared theme: rebuke","Shared theme: commands","Shared theme: myths and truth","Shared theme: myths","Shared theme: men","Shared theme: rejected","Shared theme: myths and rejected","Shared theme: consciences","Shared theme: pure","Shared theme: consciences and defiled","Shared theme: defiled","Shared theme: unbelieving","Shared theme: minds","Shared theme: consciences and pure","Shared theme: deny","Shared theme: deed and good","Another part of the same passage in Titus 2","Shared theme: doctrine and sound","Shared theme: temperate, controlled and self","Shared theme: temperate and dignified","Shared theme: love","Shared theme: perseverance and self","Shared theme: faith and love","Shared theme: dignified","Shared theme: older and men","Shared theme: slanderers and women","Shared theme: likewise and wine","Shared theme: likewise, women and good","Shared theme: women","Shared theme: teachers","Shared theme: wine","Shared theme: behavior","Shared theme: young","Shared theme: husbands","Shared theme: husbands and women","Shared theme: discredited","Shared theme: submissive, pure and husbands","Shared theme: husbands and households","Shared theme: pure and word","Shared theme: younger and men","Shared theme: example","Shared theme: works and good","Shared theme: show","Shared theme: show and works","Shared theme: works","Shared theme: dignity","Shared theme: reproach","Shared theme: ashamed","Shared theme: bad","Shared theme: speech","Shared theme: submit and masters","Shared theme: slaves, masters and pleasing","Shared theme: submit","Shared theme: masters","Shared theme: pleasing","Shared theme: respect and good","Shared theme: respect","Shared theme: grace","Titus 2:11 and Acts 13:43 share the same words","Shared theme: grace and appeared","Titus 2:11 and Hebrews 2:9 share the same words","Shared theme: appeared","Titus 2:11 and Colossians 1:6 share the same words","Shared theme: salvation","Shared theme: salvation and bringing","Shared theme: grace and bringing","Titus 2:11 and Acts 11:23 share the same words","Titus 2:11 and Galatians 2:21 share the same words","Titus 2:11 and Hebrews 12:15 share the same words","Shared theme: live","Titus 2:12 and 1 Timothy 6:17 share the same words","Shared theme: worldly","Shared theme: age","Shared theme: age and present","Shared theme: passions","Shared theme: present","Titus 2:13 and 2 Peter 1:1 share the same words","Shared theme: await, Christ and Jesus","Shared theme: await and Christ","Shared theme: await, Savior and glorious","Shared theme: Jesus","Shared theme: hope, blessed and Christ","Shared theme: hope and Christ","Shared theme: hope, Christ and Jesus","Shared theme: glorious","Shared theme: glorious, hope and Christ","Shared theme: appearance, Christ and Jesus","Shared theme: Savior, hope and Christ","Titus 2:13 and 2 Peter 3:18 share the same words","Shared theme: purify","Shared theme: deeds and good","Titus 2:14 quotes Deuteronomy 7:6","Shared theme: redeem","Titus 2:14 quotes Deuteronomy 14:2","Shared theme: possession","Shared theme: zealous","Shared theme: encourage and rebuke","Shared theme: despise","Shared theme: authority","Shared theme: encourage","Shared theme: authorities, submit and rulers","Shared theme: believers, submit and good","Shared theme: work and good","Shared theme: rulers","Another part of the same passage in Titus 3","Shared theme: remind","Shared theme: work","Shared theme: ready and work","Shared theme: peaceable and gentle","Shared theme: gentle and full","Shared theme: gentle","Shared theme: living","Shared theme: desires and living","Shared theme: hated","Shared theme: malice and envy","Shared theme: disobedient","Shared theme: desires","Shared theme: malice","Shared theme: Savior and appeared","Shared theme: kindness and love","Titus 3:4 and 1 Timothy 1:1 share the same words","Shared theme: kindness","Titus 3:4 and Titus 1:3 share the same words","Titus 3:4 and 1 Timothy 2:3 share the same words","Titus 3:4 quotes 2 Samuel 9:3","Shared theme: Spirit","Shared theme: saved","Shared theme: washing and Spirit","Shared theme: saved and holy","Shared theme: washing","Shared theme: mercy","Shared theme: mercy, birth and new","Shared theme: righteous","Shared theme: mercy and holy","Shared theme: done","Shared theme: new","Shared theme: holy and Spirit","Shared theme: poured and Spirit","Shared theme: Christ, Spirit and Jesus","Shared theme: Spirit and Jesus","Shared theme: heirs","Titus 3:7 and Titus 1:2 share the same words","Shared theme: justified and grace","Shared theme: justified","Shared theme: justified, grace and hope","Shared theme: eternal, grace and life","Shared theme: heirs and life","Shared theme: trustworthy and saying","Shared theme: believed","Shared theme: devote, deeds and good","Shared theme: deeds","Shared theme: want","Shared theme: avoid","Shared theme: avoid and quarrels","Shared theme: quarrels and foolish","Shared theme: genealogies","Shared theme: genealogies and law","Shared theme: controversies","Shared theme: quarrels","Shared theme: law","Shared theme: arguments and avoid","Shared theme: man","Shared theme: second","Shared theme: condemned","Shared theme: knowing","Shared theme: condemned and knowing","Shared theme: Tychicus","Shared theme: effort","Shared theme: winter and effort","Shared theme: winter","Shared theme: soon","Shared theme: Apollos","Shared theme: need","Shared theme: equip","Shared theme: needs, works and good","Shared theme: order and works","Shared theme: devote, works and good","Shared theme: g